"question1", "answer1"
"question2", "answer2"
"question3", "answer3"
"question4", "answer4"
"question5", "answer5"
"question6", "answer6"
"Lorem question", "Lorem ipsum dolor sit amet, consectetur adipiscing elit, sed do eiusmod tempor incididunt ut labore et dolore magna aliqua. Aliquet risus feugiat in ante metus dictum at. Adipiscing bibendum est ultricies integer quis auctor elit sed vulputate. Scelerisque felis imperdiet proin fermentum leo vel. Volutpat est velit egestas dui id. Integer feugiat scelerisque varius morbi enim nunc faucibus. Faucibus a pellentesque sit amet porttitor eget. Non tellus orci ac auctor augue mauris augue neque. Feugiat nibh sed pulvinar proin gravida hendrerit. Elit ullamcorper dignissim cras tincidunt lobortis. Odio eu feugiat pretium nibh ipsum consequat nisl. Habitant morbi tristique senectus et netus et. Porta lorem mollis aliquam ut. Nibh tellus molestie nunc non blandit massa. Elementum nisi quis eleifend quam adipiscing vitae. Scelerisque in dictum non consectetur a erat nam at lectus. Vel turpis nunc eget lorem dolor sed. Aliquam sem fringilla ut morbi tincidunt augue. Sem fringilla ut morbi tincidunt augue interdum velit euismod. Ut porttitor leo a diam sollicitudin tempor id eu nisl.

Iaculis nunc sed augue lacus viverra. Consequat id porta nibh venenatis cras sed. Sed felis eget velit aliquet sagittis id consectetur purus. Morbi tincidunt ornare massa eget egestas. Pulvinar etiam non quam lacus suspendisse. Congue nisi vitae suscipit tellus mauris a diam maecenas sed. Sapien pellentesque habitant morbi tristique. Ultricies leo integer malesuada nunc vel risus commodo viverra maecenas. Diam vel quam elementum pulvinar etiam non. Dui nunc mattis enim ut tellus elementum sagittis. Egestas egestas fringilla phasellus faucibus scelerisque. Et netus et malesuada fames ac. Ut placerat orci nulla pellentesque dignissim enim sit. Urna nec tincidunt praesent semper feugiat nibh sed pulvinar. Elementum sagittis vitae et leo duis. Ac odio tempor orci dapibus ultrices in iaculis nunc sed. Hendrerit dolor magna eget est lorem ipsum.

Posuere morbi leo urna molestie at elementum eu facilisis. Ultrices mi tempus imperdiet nulla malesuada pellentesque. Libero enim sed faucibus turpis in eu mi bibendum. Nibh venenatis cras sed felis eget velit aliquet sagittis id. In vitae turpis massa sed. Sed sed risus pretium quam vulputate dignissim suspendisse in est. Egestas maecenas pharetra convallis posuere morbi leo urna molestie at. Habitant morbi tristique senectus et. Cursus euismod quis viverra nibh cras. Mauris vitae ultricies leo integer malesuada. Tempor orci dapibus ultrices in iaculis. Id velit ut tortor pretium viverra suspendisse potenti. Enim ut sem viverra aliquet eget. Pharetra diam sit amet nisl.

Quam lacus suspendisse faucibus interdum posuere lorem. Elit scelerisque mauris pellentesque pulvinar pellentesque. Egestas egestas fringilla phasellus faucibus scelerisque eleifend. Dictum non consectetur a erat. Libero justo laoreet sit amet cursus sit amet dictum sit. Commodo viverra maecenas accumsan lacus vel. Faucibus vitae aliquet nec ullamcorper sit amet risus nullam. Elit ut aliquam purus sit amet luctus venenatis lectus magna. Nulla at volutpat diam ut venenatis tellus in metus vulputate. Sit amet mattis vulputate enim nulla aliquet porttitor. Accumsan sit amet nulla facilisi morbi tempus iaculis urna id. Et malesuada fames ac turpis egestas maecenas pharetra convallis.

Condimentum vitae sapien pellentesque habitant morbi tristique. Massa eget egestas purus viverra accumsan in. Tellus in metus vulputate eu scelerisque felis imperdiet proin fermentum. Non enim praesent elementum facilisis. Morbi tristique senectus et netus et malesuada. Elit scelerisque mauris pellentesque pulvinar pellentesque habitant morbi tristique senectus. Semper risus in hendrerit gravida. Eget mi proin sed libero enim sed faucibus turpis in. Id aliquet risus feugiat in. Porttitor lacus luctus accumsan tortor. Non nisi est sit amet.

Vel quam elementum pulvinar etiam non quam lacus suspendisse faucibus. Eu lobortis elementum nibh tellus. Vulputate dignissim suspendisse in est ante in nibh. Ultricies tristique nulla aliquet enim tortor at auctor urna nunc. Id diam vel quam elementum pulvinar etiam. Rhoncus mattis rhoncus urna neque viverra justo nec ultrices dui. In hac habitasse platea dictumst quisque sagittis purus. Lacus sed turpis tincidunt id. Mattis vulputate enim nulla aliquet porttitor lacus. Lorem sed risus ultricies tristique nulla aliquet. Curabitur gravida arcu ac tortor dignissim. Ante metus dictum at tempor. Malesuada fames ac turpis egestas integer eget aliquet nibh praesent. At volutpat diam ut venenatis tellus in metus vulputate eu. Est lorem ipsum dolor sit amet consectetur. Auctor elit sed vulputate mi sit amet mauris commodo.

Cursus eget nunc scelerisque viverra mauris in aliquam sem fringilla. Morbi quis commodo odio aenean. Viverra accumsan in nisl nisi scelerisque eu ultrices vitae auctor. Viverra vitae congue eu consequat ac. Nec sagittis aliquam malesuada bibendum arcu vitae elementum. Et magnis dis parturient montes. Tellus orci ac auctor augue. Platea dictumst quisque sagittis purus. Elit eget gravida cum sociis natoque. Lacus laoreet non curabitur gravida arcu. Cursus euismod quis viverra nibh cras. Neque laoreet suspendisse interdum consectetur libero id faucibus nisl. Laoreet id donec ultrices tincidunt arcu non.

Magna etiam tempor orci eu lobortis elementum nibh tellus molestie. Blandit libero volutpat sed cras ornare arcu dui vivamus arcu. Ultrices in iaculis nunc sed augue. Duis ut diam quam nulla porttitor massa id. Sollicitudin aliquam ultrices sagittis orci a scelerisque. Porttitor lacus luctus accumsan tortor posuere ac ut consequat semper. Etiam non quam lacus suspendisse faucibus. Amet nulla facilisi morbi tempus iaculis urna. Platea dictumst vestibulum rhoncus est pellentesque elit ullamcorper dignissim. Vestibulum sed arcu non odio euismod. Proin gravida hendrerit lectus a. Tempus iaculis urna id volutpat lacus. Sodales neque sodales ut etiam sit.

Tempor commodo ullamcorper a lacus vestibulum sed arcu non odio. Tortor posuere ac ut consequat semper. Tristique risus nec feugiat in fermentum posuere urna nec. Posuere ac ut consequat semper viverra nam libero justo. Curabitur gravida arcu ac tortor dignissim convallis aenean. Ut sem viverra aliquet eget. Purus faucibus ornare suspendisse sed nisi. Scelerisque eleifend donec pretium vulputate sapien nec sagittis aliquam. Aliquet bibendum enim facilisis gravida. Nibh praesent tristique magna sit amet purus gravida quis. Nibh mauris cursus mattis molestie. Suspendisse ultrices gravida dictum fusce ut placerat orci nulla. Eu volutpat odio facilisis mauris sit amet massa vitae tortor. Interdum velit euismod in pellentesque massa placerat. Vestibulum lectus mauris ultrices eros in cursus. Vitae congue mauris rhoncus aenean vel elit. Non blandit massa enim nec dui nunc mattis enim ut. Turpis egestas sed tempus urna et pharetra pharetra massa.

Mi bibendum neque egestas congue quisque egestas. Maecenas volutpat blandit aliquam etiam erat velit scelerisque. Cras fermentum odio eu feugiat pretium nibh ipsum. Sit amet consectetur adipiscing elit ut aliquam purus sit amet. Vel eros donec ac odio. A iaculis at erat pellentesque adipiscing. Ipsum dolor sit amet consectetur adipiscing elit. Nulla at volutpat diam ut. Felis eget nunc lobortis mattis aliquam faucibus. Consequat ac felis donec et odio. Eget est lorem ipsum dolor sit amet. Habitant morbi tristique senectus et netus et malesuada. Facilisis sed odio morbi quis commodo odio.

Porttitor eget dolor morbi non arcu. Hac habitasse platea dictumst quisque sagittis purus sit amet. Ultricies integer quis auctor elit sed. Ultrices gravida dictum fusce ut placerat. Ornare quam viverra orci sagittis eu volutpat. Laoreet id donec ultrices tincidunt arcu non. Vel quam elementum pulvinar etiam. Suspendisse in est ante in nibh mauris. Quam pellentesque nec nam aliquam sem et. Bibendum at varius vel pharetra vel turpis nunc eget. Cursus sit amet dictum sit amet justo donec enim diam. Consequat semper viverra nam libero. Lectus magna fringilla urna porttitor rhoncus. Felis imperdiet proin fermentum leo vel. Congue quisque egestas diam in arcu.

Ac odio tempor orci dapibus ultrices in iaculis nunc sed. Tellus in hac habitasse platea dictumst vestibulum rhoncus est pellentesque. Tellus orci ac auctor augue mauris. Venenatis tellus in metus vulputate. Id cursus metus aliquam eleifend mi in. Cursus in hac habitasse platea dictumst. Elementum tempus egestas sed sed risus pretium quam. Elit ut aliquam purus sit amet luctus venenatis lectus magna. Orci dapibus ultrices in iaculis. Quis commodo odio aenean sed adipiscing. Mi in nulla posuere sollicitudin aliquam ultrices sagittis. A diam maecenas sed enim ut sem. Mauris a diam maecenas sed enim ut sem viverra aliquet. Sed nisi lacus sed viverra.

Tincidunt vitae semper quis lectus nulla at volutpat diam. Sagittis id consectetur purus ut faucibus pulvinar elementum integer enim. Tincidunt dui ut ornare lectus sit amet. Dictum varius duis at consectetur lorem donec massa. Platea dictumst quisque sagittis purus. Lacus vel facilisis volutpat est velit egestas dui id. Sapien eget mi proin sed. Ridiculus mus mauris vitae ultricies. Enim ut tellus elementum sagittis vitae. Massa sapien faucibus et molestie ac feugiat sed lectus.

Amet est placerat in egestas erat imperdiet sed euismod. Vel fringilla est ullamcorper eget nulla. Amet venenatis urna cursus eget nunc scelerisque viverra mauris. Lorem ipsum dolor sit amet consectetur adipiscing. Sagittis orci a scelerisque purus semper eget duis. Tellus rutrum tellus pellentesque eu. Enim tortor at auctor urna nunc id cursus. Amet consectetur adipiscing elit duis. Scelerisque eleifend donec pretium vulputate. Tincidunt praesent semper feugiat nibh sed pulvinar. Mattis nunc sed blandit libero volutpat sed cras. Fames ac turpis egestas integer eget aliquet nibh. Et magnis dis parturient montes nascetur ridiculus mus mauris. Sit amet consectetur adipiscing elit ut aliquam. Dictumst quisque sagittis purus sit amet volutpat. Integer eget aliquet nibh praesent tristique magna sit amet purus. Pretium viverra suspendisse potenti nullam ac tortor vitae purus faucibus. Morbi tristique senectus et netus et malesuada fames ac turpis. Duis ut diam quam nulla. At erat pellentesque adipiscing commodo elit at imperdiet dui.

Diam maecenas sed enim ut. Viverra ipsum nunc aliquet bibendum. Commodo odio aenean sed adipiscing diam donec. Morbi tincidunt augue interdum velit. Duis at consectetur lorem donec massa sapien faucibus. Magnis dis parturient montes nascetur ridiculus mus mauris vitae ultricies. Eget dolor morbi non arcu risus quis. Sed turpis tincidunt id aliquet risus. Vel risus commodo viverra maecenas accumsan. Egestas sed sed risus pretium quam vulputate dignissim suspendisse in. Enim nec dui nunc mattis enim. Lectus proin nibh nisl condimentum id venenatis a. Nam aliquam sem et tortor consequat id. Egestas fringilla phasellus faucibus scelerisque. Orci eu lobortis elementum nibh tellus. Elit pellentesque habitant morbi tristique. Nisl purus in mollis nunc sed."

